{
  "processor": "stripe",
  "processor_event_id": "evt_1PZQaBcDeFgHiJkLmNoPqR4",
  "kind": "payment",
  "customer_id": "cus_R1pQKz9xLp2mN4vB6yH8jL0",
  "subscription_id": "sub_1PZQaBcDeFgHiJkLmNoPqR1",
  "invoice_id": "in_1PZQaBcDeFgHiJkLmNoPqR3",
  "payment_intent_id": "pi_3PZQaBcDeFgHiJkLmNoPqR4",
  "email": "billing@example.com",
  "paid": true,
  "amount": {
    "amount_minor": 8700,
    "currency": "USD"
  },
  "attempt_count": 1,
  "next_payment_attempt": null
}